{
  "apiVersion": "delivery.onlinejudge.io/v2",
  "kind": "WorkloadManifest",
  "metadata": {
    "name": "onlinejudge-platform",
    "version": "v2",
    "ownerIssue": "#336"
  },
  "sharedTriggerPaths": [
    "deploy/platform/**",
    "scripts/platform/**",
    "docs/开发/D7-平台工作负载清单契约.md"
  ],
  "sharedServiceContractPaths": [
    "contracts/v2/**",
    "docs/adr/ADR-006-五业务服务与可靠消息契约.md",
    "docs/开发/D4-CROSS-SERVICE-共享契约.md",
    "docs/开发/D6-D7-五服务共享契约-v2.md",
    "scripts/ci/contract-verify.sh",
    "scripts/ci/verify-microservice-contract-v2.mjs",
    "scripts/ci/verify-workflow-gates.test.sh"
  ],
  "workloads": [
    {
      "name": "gateway",
      "type": "gateway",
      "sourcePaths": ["services/gateway/**", "deploy/gateway/**"],
      "dockerfile": "services/gateway/Dockerfile",
      "image": {
        "repository": "onlinejudge/gateway",
        "tagTemplate": "${GIT_SHA}",
        "build": true,
        "sbomRequired": true
      },
      "ports": [{"name": "http", "containerPort": 8080, "protocol": "TCP", "external": true}],
      "health": {
        "startup": {"kind": "http", "target": "/health/startup", "requiredDependencies": []},
        "liveness": {"kind": "http", "target": "/health/live", "requiredDependencies": []},
        "readiness": {"kind": "http", "target": "/health/ready", "requiredDependencies": []}
      },
      "dependsOn": ["identity-service", "course-service", "assessment-api", "grade-service", "learning-service", "frontend"],
      "migrationJob": null,
      "configuration": ["GATEWAY_HTTP_PORT", "REQUEST_ID_HEADER"],
      "secrets": [
        {"key": "GATEWAY_SERVICE_IDENTITY", "injectedAs": "workload-identity", "redact": true, "imageBuild": "forbidden"},
        {"key": "IDENTITY_JWKS_TRUST_BUNDLE", "injectedAs": "runtime-secret", "redact": true, "imageBuild": "forbidden"}
      ],
      "resources": {"requests": {"cpu": "100m", "memory": "128Mi"}, "limits": {"cpu": "500m", "memory": "512Mi"}},
      "pathTriggers": ["services/gateway/**", "deploy/gateway/**"],
      "traffic": {
        "exposed": true,
        "routePrefixes": ["/api"],
        "browserEntry": {"path": "/", "targetWorkload": "frontend"}
      }
    },
    {
      "name": "identity-service",
      "type": "service",
      "sourcePaths": ["services/identity/**", "backend/src/main/java/com/onlinejudge/auth/**", "backend/src/main/java/com/onlinejudge/common/**", "backend/src/main/java/com/onlinejudge/integration/**", "backend/src/main/resources/**", "backend/pom.xml", "contracts/v2/**", "docs/adr/ADR-006-五业务服务与可靠消息契约.md", "docs/开发/D4-CROSS-SERVICE-共享契约.md", "docs/开发/D6-D7-五服务共享契约-v2.md", "scripts/ci/contract-verify.sh", "scripts/ci/verify-microservice-contract-v2.mjs", "scripts/ci/verify-workflow-gates.test.sh"],
      "dockerfile": "services/identity/Dockerfile",
      "image": {
        "repository": "onlinejudge/identity-service",
        "tagTemplate": "${GIT_SHA}",
        "build": true,
        "sbomRequired": true
      },
      "ports": [{"name": "http", "containerPort": 8081, "protocol": "TCP", "external": false}],
      "health": {
        "startup": {"kind": "http", "target": "/actuator/health/readiness", "requiredDependencies": ["mysql"]},
        "liveness": {"kind": "http", "target": "/actuator/health/liveness", "requiredDependencies": []},
        "readiness": {"kind": "http", "target": "/actuator/health/readiness", "requiredDependencies": ["mysql"]}
      },
      "dependsOn": ["mysql"],
      "migrationJob": "identity-migrations",
      "configuration": ["IDENTITY_HTTP_PORT", "IDENTITY_JWT_ISSUER", "IDENTITY_JWT_AUDIENCE", "MYSQL_HOST", "MYSQL_PORT", "IDENTITY_DATABASE_NAME", "IDENTITY_DATABASE_USER"],
      "secrets": [
        {"key": "IDENTITY_DATABASE_PASSWORD", "injectedAs": "runtime-secret", "redact": true, "imageBuild": "forbidden"},
        {"key": "IDENTITY_JWT_SIGNING_KEY", "injectedAs": "runtime-secret", "redact": true, "imageBuild": "forbidden"}
      ],
      "resources": {"requests": {"cpu": "200m", "memory": "256Mi"}, "limits": {"cpu": "1000m", "memory": "1Gi"}},
      "pathTriggers": ["services/identity/**", "backend/src/main/java/com/onlinejudge/auth/**", "backend/src/main/java/com/onlinejudge/common/**", "backend/src/main/java/com/onlinejudge/integration/**", "backend/src/main/resources/**", "backend/pom.xml", "contracts/v2/**", "docs/adr/ADR-006-五业务服务与可靠消息契约.md", "docs/开发/D4-CROSS-SERVICE-共享契约.md", "docs/开发/D6-D7-五服务共享契约-v2.md", "scripts/ci/contract-verify.sh", "scripts/ci/verify-microservice-contract-v2.mjs", "scripts/ci/verify-workflow-gates.test.sh", "database/migrations/identity/**"],
      "traffic": {"exposed": false, "routePrefixes": ["/api/v1/auth", "/.well-known/jwks.json"], "browserEntry": null}
    },
    {
      "name": "course-service",
      "type": "service",
      "sourcePaths": ["services/course/**", "backend/src/main/java/com/onlinejudge/crs/**", "backend/src/main/java/com/onlinejudge/common/**", "backend/src/main/java/com/onlinejudge/integration/**", "backend/src/main/resources/**", "backend/pom.xml", "contracts/v2/**", "docs/adr/ADR-006-五业务服务与可靠消息契约.md", "docs/开发/D4-CROSS-SERVICE-共享契约.md", "docs/开发/D6-D7-五服务共享契约-v2.md", "scripts/ci/contract-verify.sh", "scripts/ci/verify-microservice-contract-v2.mjs", "scripts/ci/verify-workflow-gates.test.sh"],
      "dockerfile": "services/course/Dockerfile",
      "image": {
        "repository": "onlinejudge/course-service",
        "tagTemplate": "${GIT_SHA}",
        "build": true,
        "sbomRequired": true
      },
      "ports": [{"name": "http", "containerPort": 8082, "protocol": "TCP", "external": false}],
      "health": {
        "startup": {"kind": "http", "target": "/actuator/health/readiness", "requiredDependencies": ["mysql"]},
        "liveness": {"kind": "http", "target": "/actuator/health/liveness", "requiredDependencies": []},
        "readiness": {"kind": "http", "target": "/actuator/health/readiness", "requiredDependencies": ["mysql"]}
      },
      "dependsOn": ["mysql"],
      "migrationJob": "course-migrations",
      "configuration": ["COURSE_HTTP_PORT", "MYSQL_HOST", "MYSQL_PORT", "COURSE_DATABASE_NAME", "COURSE_DATABASE_USER", "IDENTITY_JWT_ISSUER", "IDENTITY_JWT_AUDIENCE", "IDENTITY_JWKS_URI", "IDENTITY_JWKS_REFRESH_INTERVAL", "IDENTITY_JWKS_REFRESH_INITIAL_DELAY", "IDENTITY_JWKS_REQUEST_TIMEOUT"],
      "secrets": [
        {"key": "COURSE_DATABASE_PASSWORD", "injectedAs": "runtime-secret", "redact": true, "imageBuild": "forbidden"},
        {"key": "IDENTITY_JWKS_TRUST_BUNDLE", "injectedAs": "runtime-secret", "redact": true, "imageBuild": "forbidden"},
        {"key": "COURSE_SERVICE_IDENTITY", "injectedAs": "workload-identity", "redact": true, "imageBuild": "forbidden"}
      ],
      "resources": {"requests": {"cpu": "200m", "memory": "256Mi"}, "limits": {"cpu": "1000m", "memory": "1Gi"}},
      "pathTriggers": ["services/course/**", "backend/src/main/java/com/onlinejudge/crs/**", "backend/src/main/java/com/onlinejudge/common/**", "backend/src/main/java/com/onlinejudge/integration/**", "backend/src/main/resources/**", "backend/pom.xml", "contracts/v2/**", "docs/adr/ADR-006-五业务服务与可靠消息契约.md", "docs/开发/D4-CROSS-SERVICE-共享契约.md", "docs/开发/D6-D7-五服务共享契约-v2.md", "scripts/ci/contract-verify.sh", "scripts/ci/verify-microservice-contract-v2.mjs", "scripts/ci/verify-workflow-gates.test.sh", "database/migrations/course/**"],
      "traffic": {"exposed": false, "routePrefixes": ["/api/v1/courses"], "browserEntry": null}
    },
    {
      "name": "assessment-api",
      "type": "service",
      "sourcePaths": ["services/assessment/**", "backend/src/main/java/com/onlinejudge/lab/**", "backend/src/main/java/com/onlinejudge/hwk/**", "backend/src/main/java/com/onlinejudge/common/**", "backend/src/main/java/com/onlinejudge/integration/**", "backend/src/main/resources/**", "backend/pom.xml", "contracts/v2/**", "docs/adr/ADR-006-五业务服务与可靠消息契约.md", "docs/开发/D4-CROSS-SERVICE-共享契约.md", "docs/开发/D6-D7-五服务共享契约-v2.md", "scripts/ci/contract-verify.sh", "scripts/ci/verify-microservice-contract-v2.mjs", "scripts/ci/verify-workflow-gates.test.sh"],
      "dockerfile": "services/assessment/Dockerfile",
      "image": {
        "repository": "onlinejudge/assessment-api",
        "tagTemplate": "${GIT_SHA}",
        "build": true,
        "sbomRequired": true
      },
      "ports": [{"name": "http", "containerPort": 8083, "protocol": "TCP", "external": false}],
      "health": {
        "startup": {"kind": "http", "target": "/actuator/health/readiness", "requiredDependencies": ["mysql"]},
        "liveness": {"kind": "http", "target": "/actuator/health/liveness", "requiredDependencies": []},
        "readiness": {"kind": "http", "target": "/actuator/health/readiness", "requiredDependencies": ["mysql"]}
      },
      "dependsOn": ["mysql"],
      "migrationJob": "assessment-migrations",
      "configuration": ["ASSESSMENT_HTTP_PORT", "MYSQL_HOST", "MYSQL_PORT", "ASSESSMENT_DATABASE_NAME", "ASSESSMENT_DATABASE_USER", "IDENTITY_JWT_ISSUER", "IDENTITY_JWT_AUDIENCE", "IDENTITY_JWKS_URI", "IDENTITY_JWKS_REFRESH_INTERVAL", "IDENTITY_JWKS_REFRESH_INITIAL_DELAY", "IDENTITY_JWKS_REQUEST_TIMEOUT", "RABBITMQ_HOST", "RABBITMQ_PORT"],
      "secrets": [
        {"key": "ASSESSMENT_DATABASE_PASSWORD", "injectedAs": "runtime-secret", "redact": true, "imageBuild": "forbidden"},
        {"key": "IDENTITY_JWKS_TRUST_BUNDLE", "injectedAs": "runtime-secret", "redact": true, "imageBuild": "forbidden"},
        {"key": "ASSESSMENT_SERVICE_IDENTITY", "injectedAs": "workload-identity", "redact": true, "imageBuild": "forbidden"},
        {"key": "RABBITMQ_PASSWORD", "injectedAs": "runtime-secret", "redact": true, "imageBuild": "forbidden"}
      ],
      "resources": {"requests": {"cpu": "300m", "memory": "512Mi"}, "limits": {"cpu": "1500m", "memory": "2Gi"}},